{
  "id": "the-empty-handed-physician",
  "resolution": "Du Heng, attendant physician of the palace medical office. He brings nothing because there is nothing to treat. He comes to look at the body and write down what the resin has done to it.",
  "state": "closed",
  "summary": "Who is the physician who visits the Geng house empty-handed and stays two hours? He began coming after the death, not before."
}
