{
  "id": "the-green",
  "resolution": "A western gum resin from beyond the passes. The camel men burn it for the chest and keep it by their dead. Du Heng bought the whole winter's stock through Yan. It is on Geng Su's collar because he breathed it while alive; it is in the waste water because the body is washed in it.",
  "state": "closed",
  "summary": "The fourth thing in the cloth. The western traders know it: they bring it from beyond the passes, burn it for the chest in winter and keep it by their dead. Its name is a word in their language that Xu Ping cannot get his mouth round. The caravan's whole stock went this winter to a Han broker called Yan. The jars in the Geng courtyard are tied with the traders' knot. It still brings back to Xu Ping a jar on his teacher's high shelf."
}
