{
  "id": "musk-every-ninth-day",
  "resolution": "Du Heng's account, under his mark, held by Ji Wan. Part of keeping the body.",
  "state": "closed",
  "summary": "Four liang of musk to the Geng house every ninth day — enough to pack a body, and more. Bought from Ji Wan, who should have none, at a price that says there is no shortage."
}
