{
  "id": "geng-burial-delayed",
  "resolution": "The son is really on the road from Longxi. Du Heng asked the widow to keep the body above ground until he comes, and pays for the privilege. The robe went out early because the house has no money.",
  "state": "closed",
  "summary": "Master Geng Su is dead and not yet buried. Why is the burial delayed, and why was his silk cut down for reuse before he is in the ground?"
}
